{
  "schemaVersion": 2,
  "scenarioId": "http-response-lost",
  "seed": "cashu-fault-lab-v0.1.0-demo",
  "status": "passed",
  "invariants": [
    {
      "id": "at-most-once-redemption-start",
      "status": "not_observable",
      "confidence": "derived",
      "evidence": [],
      "reason": "Mint redemption-start evidence is unavailable."
    },
    {
      "id": "at-most-one-merchant-credit-per-request",
      "status": "passed",
      "confidence": "adapter_claimed",
      "evidence": [
        {
          "source": "ledger",
          "index": 5,
          "description": "Receiver ledger observation records merchant credit cardinality and value."
        }
      ]
    },
    {
      "id": "at-most-one-merchant-credit-per-delivery",
      "status": "passed",
      "confidence": "adapter_claimed",
      "evidence": [
        {
          "source": "ledger",
          "index": 5,
          "description": "Receiver ledger observation records merchant credit cardinality and value."
        }
      ]
    },
    {
      "id": "proof-set-exclusivity",
      "status": "passed",
      "confidence": "adapter_claimed",
      "evidence": [
        {
          "source": "timeline",
          "index": 1,
          "description": "Delivery-attempt identities derive a unique owner for every proof set."
        },
        {
          "source": "proofs",
          "index": 3,
          "description": "Mint evidence binds the delivery to its input proof-set identity and state."
        }
      ]
    },
    {
      "id": "delivery-identity-immutability",
      "status": "passed",
      "confidence": "adapter_claimed",
      "evidence": [
        {
          "source": "timeline",
          "index": 1,
          "description": "Ordered delivery-attempt observations retain one identity per delivery."
        },
        {
          "source": "receipt",
          "index": 6,
          "description": "Receiver receipt observation records delivery status and version."
        },
        {
          "source": "proofs",
          "index": 3,
          "description": "Mint evidence binds the delivery to its input proof-set identity and state."
        }
      ]
    },
    {
      "id": "exact-net-amount",
      "status": "passed",
      "confidence": "adapter_claimed",
      "evidence": [
        {
          "source": "receipt",
          "index": 6,
          "description": "Receiver receipt observation records delivery status and version."
        },
        {
          "source": "ledger",
          "index": 5,
          "description": "Receiver ledger observation records merchant credit cardinality and value."
        }
      ]
    },
    {
      "id": "no-premature-settlement",
      "status": "passed",
      "confidence": "adapter_claimed",
      "evidence": [
        {
          "source": "receipt",
          "index": 6,
          "description": "Receiver receipt observation records delivery status and version."
        },
        {
          "source": "ledger",
          "index": 5,
          "description": "Receiver ledger observation records merchant credit cardinality and value."
        },
        {
          "source": "proofs",
          "index": 3,
          "description": "Mint evidence binds the delivery to its input proof-set identity and state."
        },
        {
          "source": "timeline",
          "index": 4,
          "description": "Receiver settlement observation binds recovered replacement outputs."
        }
      ]
    },
    {
      "id": "no-false-rejection-after-possible-consumption",
      "status": "not_applicable",
      "confidence": "derived",
      "evidence": [],
      "reason": "No rejected receipt was observed."
    },
    {
      "id": "monotonic-receipts",
      "status": "passed",
      "confidence": "derived",
      "evidence": [
        {
          "source": "receipt",
          "index": 6,
          "description": "Receiver receipt observation records delivery status and version."
        }
      ]
    },
    {
      "id": "stable-duplicate-response",
      "status": "passed",
      "confidence": "adapter_claimed",
      "evidence": [
        {
          "source": "timeline",
          "index": 1,
          "description": "Repeated delivery attempts retain one identity and side-effect set."
        },
        {
          "source": "receipt",
          "index": 6,
          "description": "Receiver receipt observation records delivery status and version."
        },
        {
          "source": "ledger",
          "index": 5,
          "description": "Receiver ledger observation records merchant credit cardinality and value."
        },
        {
          "source": "proofs",
          "index": 3,
          "description": "Mint evidence binds the delivery to its input proof-set identity and state."
        }
      ]
    },
    {
      "id": "eventual-terminal-or-recovery-state",
      "status": "passed",
      "confidence": "derived",
      "evidence": [
        {
          "source": "receipt",
          "index": 6,
          "description": "Receiver receipt observation records delivery status and version."
        }
      ]
    },
    {
      "id": "crash-recovery",
      "status": "not_applicable",
      "confidence": "derived",
      "evidence": [],
      "reason": "The scenario does not restart a component."
    },
    {
      "id": "retry-convergence",
      "status": "passed",
      "confidence": "derived",
      "evidence": [
        {
          "source": "receipt",
          "index": 6,
          "description": "Receiver receipt observation records delivery status and version."
        }
      ]
    },
    {
      "id": "transport-convergence",
      "status": "not_applicable",
      "confidence": "derived",
      "evidence": [],
      "reason": "The scenario does not use multiple transports."
    },
    {
      "id": "independent-mint-evidence",
      "status": "passed",
      "confidence": "adapter_claimed",
      "evidence": [
        {
          "source": "proofs",
          "index": 3,
          "description": "Mint proof-state endpoint observation records the input state."
        }
      ]
    },
    {
      "id": "independent-ledger-evidence",
      "status": "passed",
      "confidence": "adapter_claimed",
      "evidence": [
        {
          "source": "ledger",
          "index": 5,
          "description": "Receiver ledger observation records merchant credit cardinality and value."
        }
      ]
    },
    {
      "id": "reproducibility",
      "status": "passed",
      "confidence": "derived",
      "evidence": [
        {
          "source": "timeline",
          "description": "Scenario ID, seed, versions, and ordered history are recorded."
        }
      ]
    },
    {
      "id": "no-unsupported-pass",
      "status": "passed",
      "confidence": "derived",
      "evidence": [
        {
          "source": "capabilities",
          "description": "Both executed roles declare the selected profile and the runner observed execution."
        }
      ]
    }
  ],
  "commands": [
    {
      "type": "configure_fault",
      "target": "http",
      "fault": "drop_response",
      "occurrence": 1
    },
    {
      "type": "send",
      "sender": "reference",
      "requestId": "AAECAwQFBgcICQoLDA0ODw"
    },
    {
      "type": "assert_quiescent"
    }
  ],
  "timeline": [
    {
      "sequence": 0,
      "at": 0,
      "phase": "invoked",
      "actor": "http",
      "event": "configure_fault",
      "commandIndex": 0
    },
    {
      "sequence": 1,
      "at": 0,
      "phase": "completed",
      "actor": "http",
      "event": "configure_fault",
      "commandIndex": 0,
      "outcome": "passed"
    },
    {
      "sequence": 2,
      "at": 0,
      "phase": "invoked",
      "actor": "reference",
      "event": "send",
      "commandIndex": 1
    },
    {
      "sequence": 3,
      "at": 0,
      "phase": "observation",
      "actor": "oracle",
      "event": "request_observed",
      "commandIndex": 1,
      "data": {
        "requestId": "cRaQMcUoyK1P81_X-Tw72Q",
        "singleUse": true
      }
    },
    {
      "sequence": 4,
      "at": 0,
      "phase": "observation",
      "actor": "oracle",
      "event": "delivery_attempted",
      "commandIndex": 1,
      "data": {
        "requestId": "cRaQMcUoyK1P81_X-Tw72Q",
        "deliveryId": "87ciHsOw54jv60iB_MAenQ",
        "payloadHash": "7fcc3dff378ce592762d294cab58712966acc7d113093a24688743d5367220e1",
        "proofSetHash": "6d6d76ed1a5f1a6fb1751ffc27ec914b5ccc9f4664f418bc9b4f9ac189301088",
        "transport": "http"
      }
    },
    {
      "sequence": 5,
      "at": 0,
      "phase": "observation",
      "actor": "oracle",
      "event": "delivery_attempted",
      "commandIndex": 1,
      "data": {
        "requestId": "cRaQMcUoyK1P81_X-Tw72Q",
        "deliveryId": "87ciHsOw54jv60iB_MAenQ",
        "payloadHash": "7fcc3dff378ce592762d294cab58712966acc7d113093a24688743d5367220e1",
        "proofSetHash": "6d6d76ed1a5f1a6fb1751ffc27ec914b5ccc9f4664f418bc9b4f9ac189301088",
        "transport": "http"
      }
    },
    {
      "sequence": 6,
      "at": 0,
      "phase": "observation",
      "actor": "oracle",
      "event": "mint_proofs_state",
      "commandIndex": 1,
      "data": {
        "proofSetHash": "6d6d76ed1a5f1a6fb1751ffc27ec914b5ccc9f4664f418bc9b4f9ac189301088",
        "state": "SPENT"
      }
    },
    {
      "sequence": 7,
      "at": 0,
      "phase": "observation",
      "actor": "oracle",
      "event": "receiver_settled",
      "commandIndex": 1,
      "data": {
        "deliveryId": "87ciHsOw54jv60iB_MAenQ",
        "replacementPlanHash": "00cb0098964ea7743f31707e409c9bc212400f2d926315fcad9a33d9f34a11bc"
      }
    },
    {
      "sequence": 8,
      "at": 0,
      "phase": "observation",
      "actor": "oracle",
      "event": "merchant_credited",
      "commandIndex": 1,
      "data": {